[
  {
    "device_class": "raspberry_pi_4",
    "measurement_type": "proving_latency",
    "proof_backend": "stark",
    "circuit_profile": {
      "family": "arkworks_bn254_poseidon",
      "r1cs_constraints": 18500,
      "transcript": "keccak"
    },
    "run_id": "placeholder-run-1",
    "warmup_index": 0,
    "sample_index": 0,
    "value": 55.5,
    "unit": "s",
    "timestamp_utc": "1970-01-01T00:00:00Z",
    "firmware_or_os": "raspbian-placeholder",
    "notes": "placeholder-not-empirical"
  }
]
