[
  {
    "device_class": "esp32_s3",
    "measurement_type": "verifier_latency",
    "proof_backend": "none",
    "circuit_profile": {
      "family": "arkworks_bn254_poseidon",
      "r1cs_constraints": 18500,
      "transcript": "none"
    },
    "run_id": "placeholder-run-1",
    "warmup_index": 0,
    "sample_index": 0,
    "value": 125.0,
    "unit": "ms",
    "timestamp_utc": "1970-01-01T00:00:00Z",
    "firmware_or_os": "esp-idf-placeholder",
    "notes": "placeholder-not-empirical"
  }
]
